{
  "instance_id": "8f0c4a52-1b7e-4d0a-9d3e-5a6b7c8d9e0f",
  "instance_secret": "svk_ins_0000000000000000000000000000000000000000000",
  "client": {
    "id": "3b9d6bcd-bbfd-4b2d-9b5d-ab8dfbbd4bed",
    "code": "FARMX",
    "name": "Farmacias X"
  },
  "policy": {
    "heartbeat_seconds": 300,
    "ingest_seconds": 300,
    "max_batch_events": 500,
    "sync_enabled": true
  }
}
